{
  "$schema": "https://agentrig.ai/schema/agentrig-lock.json",
  "capability_set": [],
  "declared_network_domains": [],
  "declared_secrets": [],
  "dependencies": [],
  "file_digests": [
    {
      "digest": "sha256:f072db289d8767e6151ca4b66fd6ea30052102d95273ad4419ed50876935247b",
      "path": ".plugin/plugin.json"
    },
    {
      "digest": "sha256:adc37366f403835c1470ab2df93d3837d4719372fc1ef8593d922e06f033f8b2",
      "path": "LICENSE"
    },
    {
      "digest": "sha256:5f2ca11555c6a7a7eabd5206f6ab4d762100a139d3406141b56004e23adac5e0",
      "path": "README.md"
    },
    {
      "digest": "sha256:e67261ff66c6fedb535b8fc8fab4e020196f6a619ce07af5ed770138f8558b2f",
      "path": "skills/security-check/security-check.sh"
    },
    {
      "digest": "sha256:b0ed321cae08a5b4192562495fe66aaccdd5f141ff102d9104b970bd38ff1423",
      "path": "skills/security-check/SKILL.md"
    }
  ],
  "plugin": "agentrig.security-check",
  "runtime_requirements": [],
  "snapshot_digest": "sha256:0b255d74b8b5cabf6d522c28fef43055909517b9f6851f361a8a889bc5eb6cc7",
  "version": "0.1.0"
}
